{
  "id": "keeper",
  "name": "Aren",
  "aliases": ["the keeper", "the lighthouse keeper"],
  "current": {
    "location": "Lighthouse island, keeper's quarters",
    "psychology": "Guarded hope — the stranger's claim about his daughter unsettles the routine he built to survive grief.",
    "knowledge": [
      "The Blackout erased all digital records 7 years ago.",
      "His daughter Mira left for the mainland 4 years ago and never returned.",
      "A stranger washed ashore in chapter 1 carrying a paper note with Mira's handwriting."
    ],
    "inventory": ["brass key to the archive", "tide chart", "father's pocket watch (stopped)"],
    "relationships": {
      "stranger": "Distrustful but indebted — the stranger brought news of Mira.",
      "mira": "Daughter, missing 4 years, presumed dead until the note."
    },
    "status": "alive"
  },
  "history": [
    {
      "as_of_chapter": 1,
      "snapshot": {
        "location": "Lighthouse island, beach",
        "psychology": "Numb routine, grief long buried under duty.",
        "knowledge": [
          "The Blackout erased all digital records 7 years ago.",
          "His daughter Mira left for the mainland 4 years ago and never returned."
        ],
        "inventory": ["brass key to the archive", "tide chart"],
        "relationships": {
          "mira": "Daughter, missing 4 years, presumed dead."
        },
        "status": "alive"
      },
      "commit": "c000001"
    },
    {
      "as_of_chapter": 2,
      "snapshot": {
        "location": "Lighthouse island, keeper's quarters",
        "psychology": "Shaken — recognized Mira's handwriting on the note. Hope and fear in equal measure.",
        "knowledge": [
          "The Blackout erased all digital records 7 years ago.",
          "His daughter Mira left for the mainland 4 years ago and never returned.",
          "A stranger washed ashore carrying a paper note with Mira's handwriting."
        ],
        "inventory": ["brass key to the archive", "tide chart", "father's pocket watch (stopped)"],
        "relationships": {
          "stranger": "Wary — the stranger claims Mira is alive on the mainland.",
          "mira": "Daughter, possibly alive per the note."
        },
        "status": "alive"
      },
      "commit": "c000002"
    }
  ]
}
